{
  "record_format_version": "v1.0",
  "decision_id": "WFADOPTDEC-0001",
  "decision_type": "WORKFLOW_FORMAL_ADOPTION",
  "decision_value": "AUTHORIZE_ADOPTION",
  "target": {
    "workflow_path": "workflows/case-production-workflow_v1.0.json",
    "workflow_version": "v1.0",
    "definition_format_version": "v1.0",
    "candidate_definition_sha256": "1913d15a27a8421dfc6cbf1fe9c1e7253317bfba1d0b49b7bf227ec2fe082eb0",
    "candidate_git_commit_sha": "16dd19a8f5ce2910988a6d116e3f91c18da42874"
  },
  "human_authority": {
    "authority_type": "EXPLICIT_HUMAN_DECISION",
    "human_actor_id": "HUMAN-0001"
  },
  "validation_evidence": {
    "definition_sha256": "1913d15a27a8421dfc6cbf1fe9c1e7253317bfba1d0b49b7bf227ec2fe082eb0",
    "result": "PASS_WITH_WARNINGS",
    "json_integrity": "PASS",
    "schema_validation": "PASS",
    "semantic_validation": "PASS",
    "governance_compatibility": "PASS",
    "tests": {
      "total": 168,
      "passed": 168,
      "failed": 0,
      "skipped": 0,
      "expected_failures": 0
    },
    "validator_exit_code": 0,
    "controlled_artifact_integrity": "PASS",
    "controlled_artifacts": [
      {
        "path": "AGENTS.md",
        "sha256": "2e949c83e8f665b1c7d5e34c27e38b3f28a4ebf00006c3fc6909d13afcea4f4d"
      },
      {
        "path": "docs/Audit Rule.md",
        "sha256": "5ed644213e9ba4a208a1070dcf8b83f7716263e69c9a5805708fd02b0bdc7034"
      },
      {
        "path": "docs/Case File Template.md",
        "sha256": "70ed9d7dbd790f7984b4067bf48c32bfac079ef91513ba54d4433e3d3bb28e5e"
      },
      {
        "path": "docs/Database Rule.md",
        "sha256": "5d53d6dab7709be520ef41098b39722a3e56c879b2b3a25aade917cf9f62eb6b"
      },
      {
        "path": "docs/Database Schema.md",
        "sha256": "5084dc8929b43b33d87aab28bee9d1fa9c22adf3c96e7a6dafe4cd5ac707082e"
      },
      {
        "path": "docs/Image Rule.md",
        "sha256": "81af92f1a57b3fee510623a3e6ae82ae4fca45c4e7b7f90cfab9ce1c193f2a15"
      },
      {
        "path": "docs/Operating Manual.md",
        "sha256": "dede99b81428c822784eca606270c07f1fed55aaf8e44b95e527fba4e3184a27"
      },
      {
        "path": "docs/ProjectORIGIN Publication Bible.md",
        "sha256": "fda7d02011825c11734bad0616d3989cf9faebb15f2a019df77de53ea0a75cdc"
      },
      {
        "path": "docs/ProjectORIGIN Repository Rule.md",
        "sha256": "c03a93e495ba3d367a20f341e4b59a595987b316b54645338d412e73ff3beb9a"
      },
      {
        "path": "schemas/workflows/case-production-workflow-definition.schema.json",
        "sha256": "6d147f041dec4e0325d78b2aba299c22ba7e82424087c5b8ca2749a6b0ed1ba3"
      },
      {
        "path": "schemas/workflows/workflow-adoption-decision.schema.json",
        "sha256": "f999c5429ceb57eb08d21d7291318b5d19069756ae3cfcd5166f84bc3c5d3af4"
      },
      {
        "path": "schemas/workflows/workflow-adoption-record.schema.json",
        "sha256": "9d366d4b11418b00c1f01f709fb85f8f690c14b0bb14aee5a167f4c366c70081"
      },
      {
        "path": "schemas/workflows/workflow-deprecation-record.schema.json",
        "sha256": "54ca50cc50fffb10e7488c8d65ad09edf2d977b779e2ce377fb571d0fa1b437f"
      },
      {
        "path": "scripts/validate-workflow.py",
        "sha256": "832c4875df90f6597ebf1c7166db09830afe5df3ac4b928fffdee5d01074041a"
      },
      {
        "path": "tests/workflows/test_validate_workflow.py",
        "sha256": "d798d6b68fd24bf21459367509af7525807f60ea033aff91ea1e0b1d7a33d974"
      }
    ],
    "warnings": [
      {
        "id": "GOVERNANCE-VERSION-UNDETERMINED",
        "message": "VERSION OBSERVATION UNDETERMINED for docs/Image Rule.md",
        "blocking": false
      },
      {
        "id": "GOVERNANCE-VERSION-UNDETERMINED",
        "message": "VERSION OBSERVATION UNDETERMINED for docs/Audit Rule.md",
        "blocking": false
      },
      {
        "id": "GOVERNANCE-VERSION-UNDETERMINED",
        "message": "VERSION OBSERVATION UNDETERMINED for docs/Operating Manual.md",
        "blocking": false
      },
      {
        "id": "GOVERNANCE-VERSION-UNDETERMINED",
        "message": "VERSION OBSERVATION UNDETERMINED for docs/Database Rule.md",
        "blocking": false
      },
      {
        "id": "GOVERNANCE-VERSION-UNDETERMINED",
        "message": "VERSION OBSERVATION UNDETERMINED for docs/Database Schema.md",
        "blocking": false
      }
    ]
  },
  "decided_at": "2026-09-11T17:19:29Z",
  "rationale": "The exact PROPOSED workflow candidate is authorized for Formal Adoption because fresh FA-06 validation bound to the exact candidate Git commit and SHA-256 completed successfully: 168/168 tests passed, all required validation layers passed, no errors were reported, all five warnings were explicitly non-blocking, and Repository integrity remained unchanged."
}
